1;20200308;Xiaomi Mi 6;sagit_global;FASTBOOT;F;V11.0.6.0.PCAMIXM;9.0;https://bigota.d.miui.com/V11.0.6.0.PCAMIXM/sagit_global_images_V11.0.6.0.PCAMIXM_20200308.0000.00_9.0_global_4e37806e9f.tgz;;;;sagit_global;ROM;F;V11.0.6.0.PCAMIXM;9.0;miui_MI6Global_V11.0.6.0.PCAMIXM_47fd8ee4ef_9.0.zip;1.7G;47fd8ee4efc6e39682e7718d668244ff;{"Other":{"txt":["Fix: Images overlapped in scrolling screenshots"]},"Status bar, Notification shade":{"txt":["Fix: Couldn't open notification settings in the Notification shade in Second space","Fix: Couldn't open the Notification shade in some cases"]}};sagit_global;ROM;F;V11.0.6.0.PCAMIXM;9.0;miui_MI6Global_V11.0.6.0.PCAMIXM_47fd8ee4ef_9.0.zip;1.7G;47fd8ee4efc6e39682e7718d668244ff;{"Status bar, Notification shade":{"txt":["Fix: Couldn't open notification settings in the Notification shade in Second space","Fix: Couldn't open the Notification shade in some cases"]},"Other":{"txt":["Fix: Images overlapped in scrolling screenshots"]}};;;;;;;;;
3;20191023;Xiaomi Mi MIX;lithium_global;FASTBOOT;F;V11.0.2.0.OAHMIXM;8.0;https://bigota.d.miui.com/V11.0.2.0.OAHMIXM/lithium_global_images_V11.0.2.0.OAHMIXM_20191023.0000.00_8.0_global_3454b31c75.tgz;;;;lithium_global;ROM;F;V11.0.2.0.OAHMIXM;8.0;miui_MIMIXGlobal_V11.0.2.0.OAHMIXM_6e058c6d8f_8.0.zip;1.5G;6e058c6d8fb8ddbb45256e2cd0877709;{"App lock":{"txt":["New: Locking Google contacts is available now"]},"System":{"txt":["New: Editing, sharing, and customizing your screenshots is now much easier","Optimization: Lock screen pocket mode"]},"Battery usage":{"txt":["Fix: Some Battery saver setting options didn't appear"]},"Sounds of nature":{"txt":["Wake up to the gentle sounds of nature with our new alarm ringtones","Notification sounds won't make you tired. Now, they keep changing dynamically, just like nature does."]},"Game speed booster":{"txt":["New: Continuous swiping opens an additional menu in Game Turbo now","New: You can create a Home screen shortcut for Game Turbo now","Fix: Hands-free call duration wasn't displayed correctly in Game Turbo","Refreshed start page of Game Turbo","Auto brightness, screenshot gestures, and Reading mode can be turned off automatically when Game Turbo is on"]},"Documents":{"txt":["Preview your documents before you open them","Stay productive and efficient with our all-new Mi Doc Viewer"]},"Xiaomi Cloud":{"txt":["Optimization: Sync with the cloud works faster now"]},"More features":{"txt":["Tasks. Manage and edit your tasks in the Notes app. Receive timely notifications and mark things done.","Quick replies. Reply to messages from any app.","Game Turbo. Turn your device into an ultimate gaming console."]},"Comprehensive design optimized for full screen display devices":{"txt":["Removing visual clutter, improving touch controls, and refining the use of color allowed us to create the system where nothing stands between you and the content"]}};lithium_global;ROM;F;V11.0.2.0.OAHMIXM;8.0;miui_MIMIXGlobal_V11.0.2.0.OAHMIXM_6e058c6d8f_8.0.zip;1.5G;6e058c6d8fb8ddbb45256e2cd0877709;{"System":{"txt":["New: Editing, sharing, and customizing your screenshots is now much easier","Optimization: Lock screen pocket mode"]},"App lock":{"txt":["New: Locking Google contacts is available now"]},"Battery usage":{"txt":["Fix: Some Battery saver setting options didn't appear"]},"Sounds of nature":{"txt":["Wake up to the gentle sounds of nature with our new alarm ringtones","Notification sounds won't make you tired. Now, they keep changing dynamically, just like nature does."]},"Game speed booster":{"txt":["New: Continuous swiping opens an additional menu in Game Turbo now","New: You can create a Home screen shortcut for Game Turbo now","Fix: Hands-free call duration wasn't displayed correctly in Game Turbo","Refreshed start page of Game Turbo","Auto brightness, screenshot gestures, and Reading mode can be turned off automatically when Game Turbo is on"]},"Documents":{"txt":["Preview your documents before you open them","Stay productive and efficient with our all-new Mi Doc Viewer"]},"Xiaomi Cloud":{"txt":["Optimization: Sync with the cloud works faster now"]},"Comprehensive design optimized for full screen display devices":{"txt":["Removing visual clutter, improving touch controls, and refining the use of color allowed us to create the system where nothing stands between you and the content"]},"More features":{"txt":["Tasks. Manage and edit your tasks in the Notes app. Receive timely notifications and mark things done.","Quick replies. Reply to messages from any app.","Game Turbo. Turn your device into an ultimate gaming console."]}};;;;;;;;;
5;20200925;Xiaomi Mi MIX 2;chiron_global;FASTBOOT;F;V12.0.1.0.PDEMIXM;9.0;https://bigota.d.miui.com/V12.0.1.0.PDEMIXM/chiron_global_images_V12.0.1.0.PDEMIXM_20200925.0000.00_9.0_global_7108ed52f4.tgz;;;;chiron_global;ROM;F;V12.0.1.0.PDEMIXM;9.0;miui_MIMIX2Global_V12.0.1.0.PDEMIXM_64006b3102_9.0.zip;1.9G;64006b310246f244c378913a44db8184;{"Home screen":{"txt":["New: App drawer allows you to keep your Home screen neat and categorizes apps so you can find them faster."]},"Notes":{"txt":["New: You can create folders with notes now.","New: New dynamic backgrounds look gorgeous!","New: Checklists of subtasks make managing your agenda much simpler."]},"Floating windows":{"txt":["New: Floating windows keep apps running in the foreground even when you pause to do other things.","New: You can minimize a floating window using a full screen gesture.","Optimization: Press and hold an app preview in Recents to choose between Split screen and floating windows."]},"Security":{"txt":["New: New animations feel natural and refreshing."]},"Dark mode":{"txt":["New: Dark mode support is also provided for third party apps now.","New: Contrast is lowered automatically in low light conditions to protect your eyes.","New: Wallpapers can be displayed in darker palette when your device switches to Dark mode."]},"Privacy protection":{"txt":["New: MIUI 12 is the first Android-based mobile OS that went through the rigorous enhanced privacy protection testing."]},"Weather":{"txt":["New: New animations bring the weather from outside directly to your screen."]}};chiron_global;ROM;F;V12.0.1.0.PDEMIXM;9.0;miui_MIMIX2Global_V12.0.1.0.PDEMIXM_64006b3102_9.0.zip;1.9G;64006b310246f244c378913a44db8184;{"Weather":{"txt":["New: New animations bring the weather from outside directly to your screen."]},"Dark mode":{"txt":["New: Dark mode support is also provided for third party apps now.","New: Contrast is lowered automatically in low light conditions to protect your eyes.","New: Wallpapers can be displayed in darker palette when your device switches to Dark mode."]},"Privacy protection":{"txt":["New: MIUI 12 is the first Android-based mobile OS that went through the rigorous enhanced privacy protection testing."]},"Security":{"txt":["New: New animations feel natural and refreshing."]},"Notes":{"txt":["New: You can create folders with notes now.","New: New dynamic backgrounds look gorgeous!","New: Checklists of subtasks make managing your agenda much simpler."]},"Floating windows":{"txt":["New: Floating windows keep apps running in the foreground even when you pause to do other things.","New: You can minimize a floating window using a full screen gesture.","Optimization: Press and hold an app preview in Recents to choose between Split screen and floating windows."]},"Home screen":{"txt":["New: App drawer allows you to keep your Home screen neat and categorizes apps so you can find them faster."]}};;;;;;;;;
8;20211213;Xiaomi Mi 8;dipper_global;FASTBOOT;F;V12.0.3.0.QEAMIXM;10.0;https://bigota.d.miui.com/V12.0.3.0.QEAMIXM/dipper_global_images_V12.0.3.0.QEAMIXM_20211213.0000.00_10.0_global_911d49e79e.tgz;;;;dipper_global;ROM;F;V12.0.3.0.QEAMIXM;10.0;miui_MI8Global_V12.0.3.0.QEAMIXM_7619340f8c_10.0.zip;2.0G;7619340f8c832445dd5fc6fdf0157274;{"Other improvements and optimizations":{"txt":["Optimization: GPS parameters"]}};dipper_global;ROM;F;V12.0.3.0.QEAMIXM;10.0;miui_MI8Global_V12.0.3.0.QEAMIXM_7619340f8c_10.0.zip;2.0G;7619340f8c832445dd5fc6fdf0157274;{"Other improvements and optimizations":{"txt":["Optimization: GPS parameters"]}};;;;;;;;;
11;20211213;Xiaomi Mi 8;dipper_ru_global;FASTBOOT;F;V12.0.2.0.QEARUXM;10.0;https://bigota.d.miui.com/V12.0.2.0.QEARUXM/dipper_ru_global_images_V12.0.2.0.QEARUXM_20211213.0000.00_10.0_global_de059bdd58.tgz;;;;dipper_ru_global;ROM;F;V12.0.2.0.QEARUXM;10.0;miui_MI8RUGlobal_V12.0.2.0.QEARUXM_94f7901ea4_10.0.zip;2.0G;94f7901ea401e80403c25ffcb49ae61c;{"Other improvements and optimizations":{"txt":["Optimization: GPS parameters"]}};dipper_ru_global;ROM;F;V12.0.2.0.QEARUXM;10.0;miui_MI8RUGlobal_V12.0.2.0.QEARUXM_94f7901ea4_10.0.zip;2.0G;94f7901ea401e80403c25ffcb49ae61c;{"Other improvements and optimizations":{"txt":["Optimization: GPS parameters"]}};;;;;;;;;
12;20200914;Xiaomi Mi 8 Lite;platina_global;FASTBOOT;F;V12.0.3.0.QDTMIXM;10.0;https://bigota.d.miui.com/V12.0.3.0.QDTMIXM/platina_global_images_V12.0.3.0.QDTMIXM_20200914.0000.00_10.0_global_5f4bd74ec8.tgz;;;;platina_global;ROM;F;V12.0.3.0.QDTMIXM;10.0;miui_MI8LiteGlobal_V12.0.3.0.QDTMIXM_ac83b9d20c_10.0.zip;1.9G;ac83b9d20c73ab713458de7592af6f52;{"Status bar, Notification shade":{"txt":["New: Screen lights up with an animation now","New: Status bar color gradient animation","Fix: Status bar wasn't displayed correctly with color inversion"]},"Security":{"txt":["New: New animations feel natural and refreshing.","New: Binging your favorite shows will be more convenient with our new video toolbox."]},"Home screen":{"txt":["New: App drawer allows you to keep your Home screen neat and categorizes apps so you can find them faster."]},"Control center":{"txt":["New: Swipe down from the upper left corner to open Notification shade and from the upper right corner to open Control center","New: When Notification shade is open, swipe down from the upper right corner to open Control center","Optimization: Control center is now closed by incoming calls","Optimization: Press and hold redirection options","Fix: Control center wasn't always displayed correctly in landscape mode"]},"Weather":{"txt":["New: New animations bring the weather from outside directly to your screen."]},"Dark mode":{"txt":["New: Dark mode support is also provided for third party apps now.","New: Contrast is lowered automatically in low light conditions to protect your eyes.","New: Wallpapers can be displayed in darker palette when your device switches to Dark mode.","Optimization: Brightness and color improvements for wallpapers in Dark mode"]},"System":{"txt":["Optimization: Full screen gestures are now ignored on the Lock screen alarm page","Fix: Home screen went black and started flashing after unlocking in some cases"]},"Floating windows":{"txt":["New: Pull down a notification sent by a messenger app to turn it into a floating window.","New: Floating windows keep apps running in the foreground even when you pause to do other things.","New: You can minimize a floating window using a full screen gesture.","Optimization: Press and hold an app preview in Recents to choose between Split screen and floating windows."]},"Notes":{"txt":["New: You can create folders with notes now.","New: New dynamic backgrounds look gorgeous!","New: Tasks are completed with a satisfying animation now.","New: Checklists of subtasks make managing your agenda much simpler."]},"Settings":{"txt":["New: Lite mode simplifies your device and brings essential features up front."]},"Highlights":{"txt":["MIUI 12. Yours alone."]},"System visuals":{"txt":["Brand new visual design works for all types of content and languages.","Magazine-level layouts bring important things into the spotlight and make content structure clear."]},"System animations":{"txt":["New: All-new physically based animation engine with advanced architecture will refresh your device's look.","New: Dynamic window technology takes switching screen orientation to a new level.","Optimization: Animations in selected scenes"]}};platina_global;ROM;F;V12.0.3.0.QDTMIXM;10.0;miui_MI8LiteGlobal_V12.0.3.0.QDTMIXM_ac83b9d20c_10.0.zip;1.9G;ac83b9d20c73ab713458de7592af6f52;{"Weather":{"txt":["New: New animations bring the weather from outside directly to your screen."]},"System":{"txt":["Optimization: Full screen gestures are now ignored on the Lock screen alarm page","Fix: Home screen went black and started flashing after unlocking in some cases"]},"Dark mode":{"txt":["New: Dark mode support is also provided for third party apps now.","New: Contrast is lowered automatically in low light conditions to protect your eyes.","New: Wallpapers can be displayed in darker palette when your device switches to Dark mode.","Optimization: Brightness and color improvements for wallpapers in Dark mode"]},"Settings":{"txt":["New: Lite mode simplifies your device and brings essential features up front."]},"Floating windows":{"txt":["New: Pull down a notification sent by a messenger app to turn it into a floating window.","New: Floating windows keep apps running in the foreground even when you pause to do other things.","New: You can minimize a floating window using a full screen gesture.","Optimization: Press and hold an app preview in Recents to choose between Split screen and floating windows."]},"Notes":{"txt":["New: You can create folders with notes now.","New: New dynamic backgrounds look gorgeous!","New: Tasks are completed with a satisfying animation now.","New: Checklists of subtasks make managing your agenda much simpler."]},"Highlights":{"txt":["MIUI 12. Yours alone."]},"System visuals":{"txt":["Brand new visual design works for all types of content and languages.","Magazine-level layouts bring important things into the spotlight and make content structure clear."]},"System animations":{"txt":["New: All-new physically based animation engine with advanced architecture will refresh your device's look.","New: Dynamic window technology takes switching screen orientation to a new level.","Optimization: Animations in selected scenes"]},"Status bar, Notification shade":{"txt":["New: Screen lights up with an animation now","New: Status bar color gradient animation","Fix: Status bar wasn't displayed correctly with color inversion"]},"Security":{"txt":["New: New animations feel natural and refreshing.","New: Binging your favorite shows will be more convenient with our new video toolbox."]},"Control center":{"txt":["New: Swipe down from the upper left corner to open Notification shade and from the upper right corner to open Control center","New: When Notification shade is open, swipe down from the upper right corner to open Control center","Optimization: Control center is now closed by incoming calls","Optimization: Press and hold redirection options","Fix: Control center wasn't always displayed correctly in landscape mode"]},"Home screen":{"txt":["New: App drawer allows you to keep your Home screen neat and categorizes apps so you can find them faster."]}};;;;;;;;;
14;20200904;Xiaomi Mi 8 Lite;platina_ru_global;FASTBOOT;F;V12.0.1.0.QDTRUXM;10.0;https://bigota.d.miui.com/V12.0.1.0.QDTRUXM/platina_ru_global_images_V12.0.1.0.QDTRUXM_20200904.0000.00_10.0_global_f145b74fea.tgz;;;;platina_ru_global;ROM;F;V12.0.1.0.QDTRUXM;10.0;miui_PLATINARUGlobal_V12.0.1.0.QDTRUXM_d7fbafa86e_10.0.zip;1.9G;d7fbafa86e2bb4066788adf4f84a1170;{"Status bar, Notification shade":{"txt":["New: Screen lights up with an animation now","New: Status bar color gradient animation","Fix: Status bar wasn't displayed correctly with color inversion"]},"Dark mode":{"txt":["Optimization: Brightness and color improvements for wallpapers in Dark mode"]},"System":{"txt":["Optimization: Full screen gestures are now ignored on the Lock screen alarm page","Fix: Home screen went black and started flashing after unlocking in some cases","Updated Android Security Patch to August 2020. Increased system security."]},"System animations":{"txt":["Optimization: Animations in selected scenes"]},"Control center":{"txt":["New: Swipe down from the upper left corner to open Notification shade and from the upper right corner to open Control center","New: When Notification shade is open, swipe down from the upper right corner to open Control center","Optimization: Control center is now closed by incoming calls","Optimization: Press and hold redirection options","Fix: Control center wasn't always displayed correctly in landscape mode"]}};platina_ru_global;ROM;F;V12.0.1.0.QDTRUXM;10.0;miui_PLATINARUGlobal_V12.0.1.0.QDTRUXM_d7fbafa86e_10.0.zip;1.9G;d7fbafa86e2bb4066788adf4f84a1170;{"Status bar, Notification shade":{"txt":["New: Screen lights up with an animation now","New: Status bar color gradient animation","Fix: Status bar wasn't displayed correctly with color inversion"]},"System":{"txt":["Optimization: Full screen gestures are now ignored on the Lock screen alarm page","Fix: Home screen went black and started flashing after unlocking in some cases","Updated Android Security Patch to August 2020. Increased system security."]},"Dark mode":{"txt":["Optimization: Brightness and color improvements for wallpapers in Dark mode"]},"System animations":{"txt":["Optimization: Animations in selected scenes"]},"Control center":{"txt":["New: Swipe down from the upper left corner to open Notification shade and from the upper right corner to open Control center","New: When Notification shade is open, swipe down from the upper right corner to open Control center","Optimization: Control center is now closed by incoming calls","Optimization: Press and hold redirection options","Fix: Control center wasn't always displayed correctly in landscape mode"]}};;;;;;;;;
16;20210611;Xiaomi Mi 9;cepheus_global;FASTBOOT;F;V12.5.1.0.RFAMIXM;11.0;https://bigota.d.miui.com/V12.5.1.0.RFAMIXM/cepheus_global_images_V12.5.1.0.RFAMIXM_20210611.0000.00_11.0_global_13a7fa1fb4.tgz;;;;cepheus_global;ROM;F;V12.5.1.0.RFAMIXM;11.0;miui_CEPHEUSGlobal_V12.5.1.0.RFAMIXM_54d23f235e_11.0.zip;2.4G;54d23f235e3c9f605f37dcde3b69407c;{"Highlights":{"txt":["MIUI 12.5. Yours alone."]},"Notes":{"txt":["New: A gesture shortcut now allows you to create notes, tasks, and excerpts anywhere.","New: Excerpts save text, URLs, and images to Notes in a few simple taps.","New: Dynamic layouts bring the typography in Notes to a new level.","New: Compose mind maps with complex structures.","New: New tools for doodling and sketching.","New: Press and hold a sketch to adjust the strokes automatically.","All-new Notes."]},"System":{"txt":["New: Response to gestures is now instant.","New: With 20 times more rendering power, there are now few limits to what you can see on your screen.","New: With custom device model adjustments, any phone becomes faster after the upgrade.","Optimization: MIUI became lighter, faster, and more durable.","Updated Android Security Patch to May 2021. Increased system security.","Stable MIUI based on Android 11"]},"Xiaomi Cloud":{"txt":["New: Location info can be now reported automatically before the device is powered off"]}};cepheus_global;ROM;F;V12.5.1.0.RFAMIXM;11.0;miui_CEPHEUSGlobal_V12.5.1.0.RFAMIXM_54d23f235e_11.0.zip;2.4G;54d23f235e3c9f605f37dcde3b69407c;{"Highlights":{"txt":["MIUI 12.5. Yours alone."]},"Notes":{"txt":["New: A gesture shortcut now allows you to create notes, tasks, and excerpts anywhere.","New: Excerpts save text, URLs, and images to Notes in a few simple taps.","New: Dynamic layouts bring the typography in Notes to a new level.","New: Compose mind maps with complex structures.","New: New tools for doodling and sketching.","New: Press and hold a sketch to adjust the strokes automatically.","All-new Notes."]},"System":{"txt":["New: Response to gestures is now instant.","New: With 20 times more rendering power, there are now few limits to what you can see on your screen.","New: With custom device model adjustments, any phone becomes faster after the upgrade.","Optimization: MIUI became lighter, faster, and more durable.","Updated Android Security Patch to May 2021. Increased system security.","Stable MIUI based on Android 11"]},"Xiaomi Cloud":{"txt":["New: Location info can be now reported automatically before the device is powered off"]}};;;;;;;;;
17;20211112;Xiaomi Mi 9;cepheus_eea_global;FASTBOOT;F;V12.5.2.0.RFAEUXM;11.0;https://bigota.d.miui.com/V12.5.2.0.RFAEUXM/cepheus_eea_global_images_V12.5.2.0.RFAEUXM_20211112.0000.00_11.0_eea_655e654e8a.tgz;;;;cepheus_eea_global;ROM;F;V12.5.2.0.RFAEUXM;11.0;miui_CEPHEUSEEAGlobal_V12.5.2.0.RFAEUXM_54d7f7ae88_11.0.zip;2.4G;54d7f7ae8800ab28f171f12168dee4e2;{"System":{"txt":["Stable MIUI based on Android 11"]}};;;;;;;;;;;;;;;;;;
18;20210715;Xiaomi Mi 9;cepheus_ru_global;FASTBOOT;F;V12.5.2.0.RFARUXM;11.0;https://bigota.d.miui.com/V12.5.2.0.RFARUXM/cepheus_ru_global_images_V12.5.2.0.RFARUXM_20210715.0000.00_11.0_global_c77976159b.tgz;;;;cepheus_ru_global;ROM;F;V12.5.2.0.RFARUXM;11.0;miui_CEPHEUSRUGlobal_V12.5.2.0.RFARUXM_b65674aa3c_11.0.zip;2.4G;b65674aa3cf9951fc49816ae36dabaf0;{"System":{"txt":["New: Response to gestures is now instant.","New: With 20 times more rendering power, there are now few limits to what you can see on your screen.","New: With custom device model adjustments, any phone becomes faster after the upgrade.","Optimization: MIUI became lighter, faster, and more durable.","Stable MIUI based on Android 11","Updated Android Security Patch to June 2021. Increased system security."]},"Notes":{"txt":["New: Excerpts save text, URLs, and images to Notes in a few simple taps.","New: Dynamic layouts bring the typography in Notes to a new level.","New: Compose mind maps with complex structures.","New: New tools for doodling and sketching.","New: Press and hold a sketch to adjust the strokes automatically.","New: A gesture shortcut now allows you to create notes, tasks, and excerpts anywhere.","All-new Notes."]},"Highlights":{"txt":["MIUI 12.5. Yours alone."]}};cepheus_ru_global;ROM;F;V12.5.2.0.RFARUXM;11.0;miui_CEPHEUSRUGlobal_V12.5.2.0.RFARUXM_b65674aa3c_11.0.zip;2.4G;b65674aa3cf9951fc49816ae36dabaf0;{"Highlights":{"txt":["MIUI 12.5. Yours alone."]},"Notes":{"txt":["New: Excerpts save text, URLs, and images to Notes in a few simple taps.","New: Dynamic layouts bring the typography in Notes to a new level.","New: Compose mind maps with complex structures.","New: New tools for doodling and sketching.","New: Press and hold a sketch to adjust the strokes automatically.","New: A gesture shortcut now allows you to create notes, tasks, and excerpts anywhere.","All-new Notes."]},"System":{"txt":["New: Response to gestures is now instant.","New: With 20 times more rendering power, there are now few limits to what you can see on your screen.","New: With custom device model adjustments, any phone becomes faster after the upgrade.","Optimization: MIUI became lighter, faster, and more durable.","Stable MIUI based on Android 11","Updated Android Security Patch to June 2021. Increased system security."]}};;;;;;;;;
19;20210516;Xiaomi Mi 9 SE;grus_global;FASTBOOT;F;V12.5.1.0.RFBMIXM;11.0;https://bigota.d.miui.com/V12.5.1.0.RFBMIXM/grus_global_images_V12.5.1.0.RFBMIXM_20210516.0000.00_11.0_global_a86a2a426e.tgz;;;;grus_global;ROM;F;V12.5.1.0.RFBMIXM;11.0;miui_GRUSGlobal_V12.5.1.0.RFBMIXM_c04478d703_11.0.zip;2.4G;c04478d7035051c90e8a8484cfd83e55;{"Xiaomi Cloud":{"txt":["New: Location info can be now reported automatically before the device is powered off"]},"System":{"txt":["New: With custom device model adjustments, any phone becomes faster after the upgrade.","New: Response to gestures is now instant.","New: With 20 times more rendering power, there are now few limits to what you can see on your screen.","Optimization: MIUI became lighter, faster, and more durable."]},"Notes":{"txt":["New: Press and hold a sketch to adjust the strokes automatically.","New: A gesture shortcut now allows you to create notes, tasks, and excerpts anywhere.","New: Excerpts save text, URLs, and images to Notes in a few simple taps.","New: Dynamic layouts bring the typography in Notes to a new level.","New: Compose mind maps with complex structures.","New: New tools for doodling and sketching.","All-new Notes."]},"Highlights":{"txt":["MIUI 12.5. Yours alone."]}};grus_global;ROM;F;V12.5.1.0.RFBMIXM;11.0;miui_GRUSGlobal_V12.5.1.0.RFBMIXM_c04478d703_11.0.zip;2.4G;c04478d7035051c90e8a8484cfd83e55;{"System":{"txt":["New: With custom device model adjustments, any phone becomes faster after the upgrade.","New: Response to gestures is now instant.","New: With 20 times more rendering power, there are now few limits to what you can see on your screen.","Optimization: MIUI became lighter, faster, and more durable."]},"Xiaomi Cloud":{"txt":["New: Location info can be now reported automatically before the device is powered off"]},"Highlights":{"txt":["MIUI 12.5. Yours alone."]},"Notes":{"txt":["New: Press and hold a sketch to adjust the strokes automatically.","New: A gesture shortcut now allows you to create notes, tasks, and excerpts anywhere.","New: Excerpts save text, URLs, and images to Notes in a few simple taps.","New: Dynamic layouts bring the typography in Notes to a new level.","New: Compose mind maps with complex structures.","New: New tools for doodling and sketching.","All-new Notes."]}};;;;;;;;;
